customer_id,query,category
509,"Where is my order being shipped from?",shipping
510,"Can I change the delivery address for my package?",shipping
511,"I want to cancel an order that is on hold.",cancellation
512,"I need to know the status of my return, it's been a week.",return
513,"The tracking information says my package is at a local post office, what should I do?",shipping
514,"How do I cancel my subscription online?",cancellation
515,"My refund for a return is still pending.",return
516,"Is the product I received covered by a warranty?",warranty
517,"I need to cancel an item that is part of a bundle.",cancellation
518,"My package was delivered to the wrong address, can you help?",shipping
519,"What is the warranty for a digital product?",warranty
520,"How do I cancel a recurring payment on my account?",cancellation
521,"I need to return an item, but the box is opened.",return
522,"Can I get a new product under warranty?",warranty
523,"My order was a gift, and I need to return it.",return
524,"I want to cancel a service I signed up for.",cancellation
525,"How can I get a replacement for a broken item under warranty?",warranty
526,"How long do I have to return a product?",return
527,"The item I received is damaged, can I get a shipping refund?",shipping
528,"I need to know the terms for a warranty claim.",warranty
529,"Can you tell me the steps for cancelling a purchase?",cancellation
530,"My tracking number is not working, what should I do?",shipping
531,"The item I received is not what I expected, I want to return it.",return
532,"How do I find my warranty information?",warranty
533,"I need to cancel a product I don't want anymore.",cancellation
534,"What is your policy for shipping to another country?",shipping
535,"Can I return an item after the return window has closed?",return
536,"My order has been on hold for a long time, I want to cancel it.",cancellation
537,"The item I bought came with a two-year warranty.",warranty
538,"How do I get a new return label from my account?",return
539,"Can I cancel a single item from my order after it has shipped?",cancellation
540,"I need to return a product that is not working.",return
541,"My product is making a weird noise, is it a warranty issue?",warranty
542,"I want to cancel my account, how can I do that?",cancellation
543,"The tracking on my order is stuck, can you help?",shipping
544,"I need to return an item, but I've lost the invoice.",return
545,"How do I get a copy of my original receipt for a warranty claim?",warranty
546,"I need to cancel an order that was placed by mistake.",cancellation
547,"The shipping fee on my order seems incorrect.",shipping
548,"What is the process for an exchange, not a refund?",return
549,"I have a question about the warranty on a bundle I bought.",warranty
550,"How long does it take for a refund to be processed?",return